{
  "schema": "showcase-view/p1-head-to-head/1",
  "claim": {
    "hypothesis": "H1",
    "state": "SUPPORTED",
    "prereg_id": null,
    "planned_in": [],
    "text": "cheap·roko reaches at least 0.9 of frontier·direct's resolve rate at no more than 0.1 of its $/verified within envelope levels ℓ ≤ 2 (fixture text)."
  },
  "arms": [
    {
      "arm": "cheap_direct",
      "label": "cheap·direct",
      "tier": "cheap",
      "harness": "direct",
      "role": "arm",
      "note": null,
      "models": ["cerebras/gpt-oss-120b"],
      "status": "run",
      "reason": null,
      "n_tasks": 40,
      "n_trials": 200,
      "resolve": {"value": 0.42, "ci": [0.35, 0.49], "metric_ref": "m-20319f732e2eaea4"},
      "usd_per_verified": {
        "value": 0.061,
        "ci": [0.052, 0.072],
        "metric_ref": "m-6d9f1a315869c2e1"
      },
      "cost_source": "provider_usage",
      "pass_hat_k": {
        "1": {"value": 0.42, "ci": [0.35, 0.49], "metric_ref": "m-e0c73c4f903878a2"},
        "3": {"value": 0.21, "ci": [0.15, 0.28], "metric_ref": "m-426a3704b6173112"},
        "5": {"value": 0.12, "ci": [0.07, 0.18], "metric_ref": "m-9055eaad116d0431"}
      },
      "outcome_sd": {"value": 0.31, "ci": null, "metric_ref": "m-c3bc922987516e3c"}
    },
    {
      "arm": "roko_fixed",
      "label": "cheap·roko",
      "tier": "cheap",
      "harness": "roko",
      "role": "arm",
      "note": null,
      "models": ["cerebras/gpt-oss-120b"],
      "status": "run",
      "reason": null,
      "n_tasks": 40,
      "n_trials": 200,
      "resolve": {"value": 0.81, "ci": [0.75, 0.86], "metric_ref": "m-dcd7fe894362749a"},
      "usd_per_verified": {
        "value": 0.083,
        "ci": [0.072, 0.097],
        "metric_ref": "m-f69d87213100d707"
      },
      "cost_source": "provider_usage",
      "pass_hat_k": {
        "1": {"value": 0.71, "ci": [0.65, 0.77], "metric_ref": "m-ddb3789c2c2563b3"},
        "3": {"value": 0.55, "ci": [0.47, 0.63], "metric_ref": "m-0b669a9c9ce3aa37"},
        "5": {"value": 0.46, "ci": [0.38, 0.54], "metric_ref": "m-1a39714e065c4abb"}
      },
      "outcome_sd": {"value": 0.22, "ci": null, "metric_ref": "m-2460d628a92630d0"}
    },
    {
      "arm": "fd_claude",
      "label": "frontier·direct",
      "tier": "frontier",
      "harness": "direct",
      "role": "arm",
      "note": null,
      "models": ["claude-opus-5-5"],
      "status": "run",
      "reason": null,
      "n_tasks": 40,
      "n_trials": 200,
      "resolve": {"value": 0.78, "ci": [0.72, 0.84], "metric_ref": "m-34e4f8e3cae26ab1"},
      "usd_per_verified": {"value": 1.92, "ci": [1.61, 2.31], "metric_ref": "m-b60ca1bace714b41"},
      "cost_source": "cli_usage",
      "pass_hat_k": {
        "1": {"value": 0.78, "ci": [0.72, 0.84], "metric_ref": "m-070e18061b5d1175"},
        "3": {"value": 0.64, "ci": [0.56, 0.71], "metric_ref": "m-ef28854c7891b0db"},
        "5": {"value": 0.57, "ci": [0.49, 0.65], "metric_ref": "m-9daa09ebf085d7b9"}
      },
      "outcome_sd": {"value": 0.19, "ci": null, "metric_ref": "m-c1beb9c034781573"}
    },
    {
      "arm": "fr_claude",
      "label": "frontier·roko",
      "tier": "frontier",
      "harness": "roko",
      "role": "probe",
      "note": "probe (48 H3 tasks)",
      "models": ["claude-opus-5-5"],
      "status": "not_run",
      "reason": "not in this bundle; the D1 probe runs the 48 H3 tasks in LOG1",
      "n_tasks": 0,
      "n_trials": 0,
      "resolve": null,
      "usd_per_verified": null,
      "cost_source": null,
      "pass_hat_k": null,
      "outcome_sd": null
    },
    {
      "arm": "fd_claude_lite",
      "label": "frontier·direct (lite)",
      "tier": "frontier",
      "harness": "direct",
      "role": "extra",
      "note": null,
      "models": ["claude-sonnet-5"],
      "status": "run",
      "reason": null,
      "n_tasks": 40,
      "n_trials": 200,
      "resolve": {"value": 0.69, "ci": [0.62, 0.75], "metric_ref": "m-d2b3a27ec972e53f"},
      "usd_per_verified": {"value": 0.95, "ci": [0.81, 1.12], "metric_ref": "m-3048c95b83a391f9"},
      "cost_source": "cli_usage",
      "pass_hat_k": {
        "1": {"value": 0.69, "ci": [0.62, 0.75], "metric_ref": "m-5d58c032df2363f1"},
        "3": {"value": 0.52, "ci": [0.44, 0.6], "metric_ref": "m-85c1b5a6e8dceb54"},
        "5": {"value": 0.43, "ci": [0.35, 0.51], "metric_ref": "m-b436c12b3920f616"}
      },
      "outcome_sd": {"value": 0.24, "ci": null, "metric_ref": "m-abc45cefbdbb6687"}
    }
  ],
  "pareto": {
    "x": "usd_per_verified",
    "y": "resolve",
    "frontier_arms": ["cheap_direct", "roko_fixed", "fd_claude"]
  },
  "envelope": [
    {
      "envelope_level": 1,
      "label": "ℓ ≤ 1",
      "n_tasks": 16,
      "cheap_resolve": {"value": 0.88, "ci": [0.79, 0.94], "metric_ref": "m-f0563de09568bb6d"},
      "frontier_resolve": {"value": 0.91, "ci": [0.83, 0.96], "metric_ref": "m-3cd1d021c6e68b94"},
      "resolve_ratio": {"value": 0.97, "ci": [0.9, 1.04], "metric_ref": "m-f672de7a2502c49c"},
      "usd_ratio": {"value": 0.04, "ci": [0.03, 0.05], "metric_ref": "m-cfcbb86f4f066a19"},
      "verdict": "within_target"
    },
    {
      "envelope_level": 2,
      "label": "ℓ ≤ 2",
      "n_tasks": 28,
      "cheap_resolve": {"value": 0.79, "ci": [0.71, 0.86], "metric_ref": "m-596086b3ec66a2d7"},
      "frontier_resolve": {"value": 0.85, "ci": [0.78, 0.91], "metric_ref": "m-8ba03e3066609275"},
      "resolve_ratio": {"value": 0.93, "ci": [0.85, 1.01], "metric_ref": "m-c0355e74fca33b9b"},
      "usd_ratio": {"value": 0.04, "ci": [0.03, 0.05], "metric_ref": "m-9c833fe4a55afef1"},
      "verdict": "within_target"
    },
    {
      "envelope_level": 3,
      "label": "ℓ ≤ 3",
      "n_tasks": 40,
      "cheap_resolve": {"value": 0.71, "ci": [0.65, 0.77], "metric_ref": "m-48d75e7216f17bf9"},
      "frontier_resolve": {"value": 0.78, "ci": [0.72, 0.84], "metric_ref": "m-00000f29be81ea8a"},
      "resolve_ratio": {"value": 0.91, "ci": [0.82, 1.0], "metric_ref": "m-4b283629fad2aa5c"},
      "usd_ratio": {"value": 0.04, "ci": [0.04, 0.05], "metric_ref": "m-b3f7237791462352"},
      "verdict": "inconclusive"
    },
    {
      "envelope_level": null,
      "label": "SWE-V",
      "n_tasks": 0,
      "cheap_resolve": null,
      "frontier_resolve": null,
      "resolve_ratio": null,
      "usd_ratio": null,
      "verdict": "not_measured"
    }
  ],
  "metrics": [
    {
      "metric_ref": "m-20319f732e2eaea4",
      "metric": "vs_rate",
      "kind": "rate",
      "value": 0.42,
      "ci": [0.35, 0.49],
      "ci_method": "wilson",
      "n": 200,
      "estimator": "mean of vs.label; an unknown label counts as 0",
      "arm": "cheap_direct",
      "envelope_level": null
    },
    {
      "metric_ref": "m-6d9f1a315869c2e1",
      "metric": "usd_per_vs",
      "kind": "usd",
      "value": 0.061,
      "ci": [0.052, 0.072],
      "ci_method": "paired_stratified_bootstrap",
      "n": 200,
      "estimator": "CPR = Σcost/Σhidden_pass",
      "arm": "cheap_direct",
      "envelope_level": null
    },
    {
      "metric_ref": "m-e0c73c4f903878a2",
      "metric": "pass_hat_1",
      "kind": "rate",
      "value": 0.42,
      "ci": [0.35, 0.49],
      "ci_method": "stratified_bootstrap",
      "n": 40,
      "estimator": "unbiased pass^1 (tau-bench)",
      "arm": "cheap_direct",
      "envelope_level": null
    },
    {
      "metric_ref": "m-426a3704b6173112",
      "metric": "pass_hat_3",
      "kind": "rate",
      "value": 0.21,
      "ci": [0.15, 0.28],
      "ci_method": "stratified_bootstrap",
      "n": 40,
      "estimator": "unbiased pass^3 (tau-bench)",
      "arm": "cheap_direct",
      "envelope_level": null
    },
    {
      "metric_ref": "m-9055eaad116d0431",
      "metric": "pass_hat_5",
      "kind": "rate",
      "value": 0.12,
      "ci": [0.07, 0.18],
      "ci_method": "stratified_bootstrap",
      "n": 40,
      "estimator": "unbiased pass^5 (tau-bench)",
      "arm": "cheap_direct",
      "envelope_level": null
    },
    {
      "metric_ref": "m-c3bc922987516e3c",
      "metric": "outcome_sd",
      "kind": "score",
      "value": 0.31,
      "ci": null,
      "ci_method": "none",
      "n": 40,
      "estimator": "sd of per-task resolve over trials",
      "arm": "cheap_direct",
      "envelope_level": null
    },
    {
      "metric_ref": "m-dcd7fe894362749a",
      "metric": "vs_rate",
      "kind": "rate",
      "value": 0.81,
      "ci": [0.75, 0.86],
      "ci_method": "wilson",
      "n": 200,
      "estimator": "mean of vs.label; an unknown label counts as 0",
      "arm": "roko_fixed",
      "envelope_level": null
    },
    {
      "metric_ref": "m-f69d87213100d707",
      "metric": "usd_per_vs",
      "kind": "usd",
      "value": 0.083,
      "ci": [0.072, 0.097],
      "ci_method": "paired_stratified_bootstrap",
      "n": 200,
      "estimator": "CPR = Σcost/Σhidden_pass",
      "arm": "roko_fixed",
      "envelope_level": null
    },
    {
      "metric_ref": "m-ddb3789c2c2563b3",
      "metric": "pass_hat_1",
      "kind": "rate",
      "value": 0.71,
      "ci": [0.65, 0.77],
      "ci_method": "stratified_bootstrap",
      "n": 40,
      "estimator": "unbiased pass^1 (tau-bench)",
      "arm": "roko_fixed",
      "envelope_level": null
    },
    {
      "metric_ref": "m-0b669a9c9ce3aa37",
      "metric": "pass_hat_3",
      "kind": "rate",
      "value": 0.55,
      "ci": [0.47, 0.63],
      "ci_method": "stratified_bootstrap",
      "n": 40,
      "estimator": "unbiased pass^3 (tau-bench)",
      "arm": "roko_fixed",
      "envelope_level": null
    },
    {
      "metric_ref": "m-1a39714e065c4abb",
      "metric": "pass_hat_5",
      "kind": "rate",
      "value": 0.46,
      "ci": [0.38, 0.54],
      "ci_method": "stratified_bootstrap",
      "n": 40,
      "estimator": "unbiased pass^5 (tau-bench)",
      "arm": "roko_fixed",
      "envelope_level": null
    },
    {
      "metric_ref": "m-2460d628a92630d0",
      "metric": "outcome_sd",